{
  "$schema": "https://liftradar.eu/schema/archive.schema.json",
  "id": "val-d-allos",
  "country": "fr",
  "name": "Val d'Allos",
  "runs": [
    {
      "time": "2026-10-26T08:26:53+01:00",
      "snapshot": "2026-10-26T07-26Z.json"
    },
    {
      "time": "2026-10-26T09:07:59+01:00",
      "snapshot": "2026-10-26T07-26Z.json"
    },
    {
      "time": "2026-10-26T14:33:15+01:00",
      "snapshot": "2026-10-26T13-33Z.json"
    },
    {
      "time": "2026-10-26T19:10:30+01:00",
      "snapshot": "2026-10-26T18-10Z.json"
    },
    {
      "time": "2026-10-27T07:54:20+01:00",
      "snapshot": "2026-10-26T18-10Z.json"
    },
    {
      "time": "2026-10-27T13:41:11+01:00",
      "snapshot": "2026-10-26T18-10Z.json"
    },
    {
      "time": "2026-10-27T21:28:42+01:00",
      "snapshot": "2026-10-27T20-28Z.json"
    }
  ]
}
