{
  "$schema": "https://liftradar.eu/schema/archive.schema.json",
  "id": "seimberg",
  "country": "de",
  "name": "Seimberg",
  "runs": [
    {
      "time": "2026-10-28T17:11:48+01:00",
      "snapshot": "2026-10-28T16-11Z.json"
    },
    {
      "time": "2026-10-28T19:10:46+01:00",
      "snapshot": "2026-10-28T18-10Z.json"
    },
    {
      "time": "2026-10-28T21:37:31+01:00",
      "snapshot": "2026-10-28T20-37Z.json"
    },
    {
      "time": "2026-10-29T14:11:53+01:00",
      "snapshot": "2026-10-28T20-37Z.json"
    }
  ]
}
