{
  "$schema": "https://liftradar.eu/schema/archive.schema.json",
  "id": "ramsau-am-dachstein",
  "country": "at",
  "name": "Ramsau am Dachstein",
  "runs": [
    {
      "time": "2026-10-27T07:54:20+01:00",
      "snapshot": "2026-10-27T06-54Z.json"
    },
    {
      "time": "2026-10-27T13:41:11+01:00",
      "snapshot": "2026-10-27T06-54Z.json"
    },
    {
      "time": "2026-10-27T21:28:42+01:00",
      "snapshot": "2026-10-27T20-28Z.json"
    },
    {
      "time": "2026-10-27T21:55:11+01:00",
      "snapshot": "2026-10-27T20-55Z.json"
    },
    {
      "time": "2026-10-28T14:32:48+01:00",
      "snapshot": "2026-10-27T20-55Z.json"
    },
    {
      "time": "2026-10-28T17:11:48+01:00",
      "snapshot": "2026-10-27T20-55Z.json"
    },
    {
      "time": "2026-10-28T19:10:46+01:00",
      "snapshot": "2026-10-27T20-55Z.json"
    },
    {
      "time": "2026-10-28T21:37:31+01:00",
      "snapshot": "2026-10-28T20-37Z.json"
    },
    {
      "time": "2026-10-29T14:11:53+01:00",
      "snapshot": "2026-10-28T20-37Z.json"
    },
    {
      "time": "2026-10-29T14:43:36+01:00",
      "snapshot": "2026-10-28T20-37Z.json"
    }
  ]
}
