{
  "$schema": "https://liftradar.eu/schema/archive.schema.json",
  "id": "braunlage-skiwiese",
  "country": "de",
  "name": "Braunlage - Skiwiese am Rathaus",
  "runs": [
    {
      "time": "2026-10-28T17:11:48+01:00",
      "snapshot": "2026-10-28T16-11Z.json"
    },
    {
      "time": "2026-10-28T19:10:46+01:00",
      "snapshot": "2026-10-28T18-10Z.json"
    }
  ]
}
