{
  "$schema": "https://liftradar.eu/schema/archive.schema.json",
  "id": "diemtigtal-wiriehorn",
  "country": "ch",
  "name": "Diemtigtal Wiriehorn",
  "runs": [
    {
      "time": "2026-10-25T11:50:12+01:00",
      "snapshot": "2026-10-25T10-50Z.json"
    },
    {
      "time": "2026-10-25T12:01:57+01:00",
      "snapshot": "2026-10-25T11-01Z.json"
    },
    {
      "time": "2026-10-25T16:00:03+01:00",
      "snapshot": "2026-10-25T15-00Z.json"
    },
    {
      "time": "2026-10-25T16:03:21+01:00",
      "snapshot": "2026-10-25T15-03Z.json"
    },
    {
      "time": "2026-10-25T16:16:14+01:00",
      "snapshot": "2026-10-25T15-16Z.json"
    },
    {
      "time": "2026-10-25T18:05:09+01:00",
      "snapshot": "2026-10-25T17-05Z.json"
    },
    {
      "time": "2026-10-25T18:17:32+01:00",
      "snapshot": "2026-10-25T17-17Z.json"
    },
    {
      "time": "2026-10-25T18:23:11+01:00",
      "snapshot": "2026-10-25T17-17Z.json"
    },
    {
      "time": "2026-10-25T21:17:03+01:00",
      "snapshot": "2026-10-25T20-17Z.json"
    },
    {
      "time": "2026-10-25T21:23:15+01:00",
      "snapshot": "2026-10-25T20-17Z.json"
    },
    {
      "time": "2026-10-26T08:26:53+01:00",
      "snapshot": "2026-10-26T07-26Z.json"
    },
    {
      "time": "2026-10-26T09:07:59+01:00",
      "snapshot": "2026-10-26T08-07Z.json"
    },
    {
      "time": "2026-10-26T14:33:15+01:00",
      "snapshot": "2026-10-26T13-33Z.json"
    },
    {
      "time": "2026-10-26T19:10:30+01:00",
      "snapshot": "2026-10-26T18-10Z.json"
    },
    {
      "time": "2026-10-27T07:54:20+01:00",
      "snapshot": "2026-10-27T06-54Z.json"
    },
    {
      "time": "2026-10-27T13:41:11+01:00",
      "snapshot": "2026-10-27T12-41Z.json"
    },
    {
      "time": "2026-10-27T21:28:42+01:00",
      "snapshot": "2026-10-27T20-28Z.json"
    },
    {
      "time": "2026-10-27T21:55:11+01:00",
      "snapshot": "2026-10-27T20-55Z.json"
    },
    {
      "time": "2026-10-28T14:32:48+01:00",
      "snapshot": "2026-10-28T13-32Z.json"
    },
    {
      "time": "2026-10-28T17:11:48+01:00",
      "snapshot": "2026-10-28T16-11Z.json"
    }
  ]
}
