{
  "$schema": "https://liftradar.eu/schema/archive.schema.json",
  "id": "goldeck",
  "country": "at",
  "name": "Goldeck",
  "runs": [
    {
      "time": "2026-10-25T18:05:09+01:00",
      "snapshot": "2026-10-25T17-05Z.json"
    },
    {
      "time": "2026-10-25T18:17:32+01:00",
      "snapshot": "2026-10-25T17-05Z.json"
    },
    {
      "time": "2026-10-25T18:23:11+01:00",
      "snapshot": "2026-10-25T17-05Z.json"
    },
    {
      "time": "2026-10-25T21:17:03+01:00",
      "snapshot": "2026-10-25T17-05Z.json"
    },
    {
      "time": "2026-10-25T21:23:15+01:00",
      "snapshot": "2026-10-25T17-05Z.json"
    },
    {
      "time": "2026-10-26T08:26:53+01:00",
      "snapshot": "2026-10-25T17-05Z.json"
    },
    {
      "time": "2026-10-26T09:07:59+01:00",
      "snapshot": "2026-10-25T17-05Z.json"
    },
    {
      "time": "2026-10-26T14:33:15+01:00",
      "snapshot": "2026-10-25T17-05Z.json"
    },
    {
      "time": "2026-10-26T19:10:30+01:00",
      "snapshot": "2026-10-25T17-05Z.json"
    },
    {
      "time": "2026-10-27T07:54:20+01:00",
      "snapshot": "2026-10-25T17-05Z.json"
    },
    {
      "time": "2026-10-27T13:41:11+01:00",
      "snapshot": "2026-10-25T17-05Z.json"
    },
    {
      "time": "2026-10-27T21:28:42+01:00",
      "snapshot": "2026-10-27T20-28Z.json"
    },
    {
      "time": "2026-10-27T21:55:11+01:00",
      "snapshot": "2026-10-27T20-55Z.json"
    },
    {
      "time": "2026-10-28T14:32:48+01:00",
      "snapshot": "2026-10-27T20-55Z.json"
    },
    {
      "time": "2026-10-28T17:11:48+01:00",
      "snapshot": "2026-10-27T20-55Z.json"
    },
    {
      "time": "2026-10-28T19:10:46+01:00",
      "snapshot": "2026-10-27T20-55Z.json"
    },
    {
      "time": "2026-10-28T21:37:31+01:00",
      "snapshot": "2026-10-28T20-37Z.json"
    },
    {
      "time": "2026-10-29T14:11:53+01:00",
      "snapshot": "2026-10-28T20-37Z.json"
    },
    {
      "time": "2026-10-29T14:43:36+01:00",
      "snapshot": "2026-10-28T20-37Z.json"
    }
  ]
}
