{
  "$schema": "https://liftradar.eu/schema/archive.schema.json",
  "id": "boedefeld-hunau",
  "country": "de",
  "name": "Bödefeld - Hunau",
  "runs": [
    {
      "time": "2026-10-28T19:10:46+01:00",
      "snapshot": "2026-10-28T18-10Z.json"
    },
    {
      "time": "2026-10-28T21:37:31+01:00",
      "snapshot": "2026-10-28T20-37Z.json"
    }
  ]
}
